{
  "schema_version": "2.0",
  "contract_version": "open-reproducibility-2.0",
  "submission_id": "example-open-model-v1",
  "dataset_id": "replace-with-dataset-id",
  "split_id": "replace_with_split_id",
  "case_set_id": "replace_with_case_set_id",
  "reference_version": "replace-with-reference-version",
  "profile_ground_truth_release_id": "prototype-profile-ground-truth-2026-08-21",
  "profile_ground_truth_manifest_sha256": "8a88dd6fc64914603a0f8f4c498a3b0ec1d349d24e8f24a2a606494221c4bd25",
  "validated_by": "FluidsBench maintainer",
  "validated_at": "2026-07-21T12:00:00Z",
  "status": "validated",
  "validation_scope": "submitted_data_only",
  "model_execution": "not_performed",
  "metric_recomputation": "not_performed",
  "reviewed_submission_sha256": "442cb58fa8853dd9911a9651ff14eca6b9bf6442cf06987f97c8ab6baf5867e7",
  "evaluation_evidence_sha256": "fd12c949d11d788ed5b0096cfc4c960bf3746fc547e68b822d2c20eccb963384",
  "profile_index_sha256": "91dd28ffbf2b49e1ba98babc9f59c304bba2c899278954de2a4db1226b089ece",
  "notes": "Maintainer template. Regenerate every checksum after replacing contributor placeholders."
}
